{
  "agent_framework": "ironclaw",
  "agent_id": "ai:alice",
  "ai_memory_ops": [
    {
      "duration_ms": 0,
      "key_or_query": "tag:phase2-tag-A",
      "namespace": "phase2/tagged",
      "ok": true,
      "op": "recall",
      "payload_sha256": "e3b0c44298fc1c149afbf4c8996fb92427ae41e4649b934ca495991b7852b855",
      "returned_records": 3,
      "scope": "team",
      "transport": "http"
    }
  ],
  "campaign_id": "a2a-ironclaw-v0.6.3.1-r27",
  "claims_grounded": [],
  "claims_made": [],
  "control_arm": "phase2",
  "llm_model_sku": "grok-4-0709",
  "node_id": "do-aim-a2a-ironclaw-a2a-ironclaw-v0",
  "notes": "",
  "phase": 2,
  "prompt_sha256": "a4c6fc43e456af87e1906436369230ed6e101eceec483614a20bfe9a9c2ca153",
  "refusals": [],
  "release": "v0.6.3.1",
  "run_index": 1,
  "scenario_id": "phase2",
  "schema_version": "v0.6.3.1-a2a-nhi-1",
  "self_confidence": 1.0,
  "system_prompt_sha256": "0000000000000000000000000000000000000000000000000000000000000000",
  "termination_reason": "task_complete",
  "timestamp_utc": "2026-05-03T05:11:00Z",
  "tools_called": [],
  "turn_id": "phase2-phase2-r1-t6"
}