{
  "agent_framework": "ironclaw",
  "agent_id": "ai:alice",
  "ai_memory_ops": [],
  "campaign_id": "a2a-ironclaw-v0.6.3.1-r15",
  "claims_grounded": [],
  "claims_made": [
    {
      "category": "factual",
      "claim_id": "ex6-sink-ai:alice",
      "text_sha256": "7902699be42c8a8e46fbbb4501726517e86b22c56a189f7625a6da49081b2451"
    }
  ],
  "control_arm": "phase2",
  "llm_model_sku": "grok-4-fast-non-reasoning",
  "node_id": "do-aim-a2a-ironclaw-a2a-ironclaw-v0",
  "notes": "",
  "phase": 2,
  "prompt_sha256": "3de8b579d39fd4882fb5ffa23f344b1f025515b977db4e6479981448608821df",
  "refusals": [],
  "release": "v0.6.3.1",
  "run_index": 1,
  "scenario_id": "phase2",
  "schema_version": "v0.6.3.1-a2a-nhi-1",
  "self_confidence": 1.0,
  "system_prompt_sha256": "0000000000000000000000000000000000000000000000000000000000000000",
  "termination_reason": "task_complete",
  "timestamp_utc": "2026-05-02T17:29:22Z",
  "tools_called": [],
  "turn_id": "phase2-phase2-r1-t8"
}